"NYKC79758, NQSV64796, ZSMM64517",ADESIVO-ALVO-TIRO-A-100UN
"GMEJ63393, AIOW65332",ADESIVO-ALVO-TIRO-A-200UN
"EJAB78418, ZWVK64796, VBJI64945",ADESIVO-ALVO-TIRO-B-100UN
"CYXU60554, WXVN54667, MQOQ50125, USDY64346, NMYY48763, AZKN64712",ADESIVO-ALVO-TIRO-B-200UN
"IOAN41382, UKXE45258",ANEL-BUJAO-BORRACHA
"NRRW41574, OOIJ45580, MBTG45735",ANEL-BUJAO-OCO-ALUMINIO
"ILQG42066, PCBV46988, QGWO45611",ANEL-BUJAO-OCO-COBRE
"JNTV25267, ERDX25809",ANTENA-GPS-RTK
"VHDQ13368, BSOP01052, BWPG49852, XNUN49435, DKAB25543, USVX25003",BOIA-LARANJA-ARAFORT
"HQNA12735, INGQ94150, UKPN49071, JHAY50118, MUHP24782, XJTD25354",BOIA-LIMA-ARAFORT
"MQVP06119, GVAV12204, VGNT49868, DEWC50224, ZVRI25320, MARS25536",BOIA-ROSA-ARAFORT
"CWND46552, GKNQ47205, AGYQ81803, RTKG80891, HZDV94386",BOMBA-OLEO-SO-002
"XDYG05952, WIVP93712, LCPO98554, RHDD08016, DBGW80891, TKHQ82798",BOMBA-OLEO-SO-004
"CUHN60786, WTJE80079, MRQI49211, NSVT51208, QVSV82780, VBLJ26896",CAPACETE-TATICO-CAQUI
"BYQM58758, XUED79552, ZZJR50085, GKFY48576, GUWD58665, AMNP32285",CAPACETE-TATICO-PRETO
"SQDZ60111, MJJQ81097, JVCW50059, IFHZ49538, KJKA58360, PAIT81680",CAPACETE-TATICO-VERDE
"JCOG60256, EUQK59753, XMWS58095", COLA-METAL
"ZSMM63546, PDSG60819, BJJC64207",CHAPEU-OKTOBER-MARROM
"ZWVK64156, GSCT60009, ILEG64139",CHAPEU-OKTOBER-PRETO
"FOWM63695, UWUX59908, DBSB62470",CHAPEU-OKTOBER-VERDE
"GUMS95497, PZYA09621, RJDB49852, EJNA50276, IZUU42701, TTSC24965",CLIP-GUIDAO
"DEBD76092, PLOO75518, NKWG40415, ZILE09856",CRONOGRAFO-PRATEADO
"OPDQ77225, RJDB76899, YIHI80550, UDVL81651",ENDOSCOPIO-ARTICULADO
"BVIG59366, BJIN79216, GOYN48012, KWQT50501, CHDG25486, CBMK25591",ENDOSCOPIO-C-10-1M
"HLRM58387, VENR69647, RCFK77410, EPFI78027, JGHG48582, XZZS49016, IZYO26266, PPLN25907",ENDOSCOPIO-C-10-5M
"ORHZ10562, DOBJ58886, QYYQ78043, RCHD48771, GVEN49367, SVTU25349, ZNQH24460",ENDOSCOPIO-C-20-5M
"RUPO49102, JGCP53298, LVJD52684, HCOD53246, XLRM57400, YBJP58926",ENDOSCOPIO-C-30-1M
"CCJM25752, FTKU25907, REAB27204",ENDOSCOPIO-C-40-1M
"VMTP93435, IYIC05526, ARLJ93173, USAY05655, UDVK26162",ENDOSCOPIO-C-40-5M
"OIVZ90459, NAJY46409, DNLH58216, YSYP57672, VXZQ58770, WCLN58903",ENDOSCOPIO-G-20-10M
"YKHP53312, ZRSF77107, DIEO94454, PLOK05094, DVMJ05382, QZBO26311",ENDOSCOPIO-P-40-5M
"PYEQ77391, PBWL59795, RTTV46122, RTSR45431",FONE-ABAFADOR-PRETO
"GGHX78172, VLVA59776, ECBV46575, XEJS46007",FONE-ABAFADOR-VERDE
"ZKBC81729, HYOK60148, NEIK46926, VKEG46259",FONE-ABAFADOR-MARROM
"RJWQ81406, XKLV59688, SJRQ77406, TQWD42343, APKY51539, UKFV62637",KIT-BLACK-THUMB-TAPE
"VHCE81370, UMLY58872, YWSG13064, HHLW48943, GVAV48771",MASCARA-MOTOCROSS-AMARELO
"CTFU82348, WTJE53866, QHUV78193, LRRC48303, PFQT48147",MASCARA-MOTOCROSS-AZUL
"LWZY78707, PCGM54963, WINA59397, AOEI47515, ZVRX48609",MASCARA-MOTOCROSS-CINZA
"BAPC82686, BCOJ57686, SQMK79030, GFNT48666, ATMB49712",MASCARA-MOTOCROSS-PRATA
"CITF80610, WJEJ58961, NEIC78384, FXPG50207, XSCL49346",MASCARA-MOTOCROSS-TRANSPARENTE
"STAG84518, GLJT59186, ZUYV12863, ZRFU47214, NKIE50796",MASCARA-MOTOCROSS-VERMELHO
"IKXN13001, CUHN88602, MMCU78138, RKQY48958",MONITOR-PESCA-30M
"WTKL78281, MJYJ93044, FLJN48856, GHCJ09684, WSEI80972",PEGADOR-GANCHO-COBRA
"XHKF94790, FLJN11748, XJEK49783, VHNQ49419, CBQU25775, SFQB25486",RELOGIO-XADREZ-PRETO
"CVKL59089, OXKN79356, URIH49604, LCPO49092, ZUNA25493, UHDJ26115",ROUPA-CAMUFLADA-G
"MYDP77169, XZEM58840, PFQT48008, ZRTB48904, XLRM24977, OXCT25320",ROUPA-CAMUFLADA-M
"SNTE79608, CNUQ59275, GRIP48991, AREN48716, BNLS25504, CSLD29315",ROUPA-CAMUFLADA-P
"JSNK07513, MPQE08305, RTKG08426, BOAQ08662, NGMH25280, FKXN25618",TACO-AZUL
"ISMK97206, AVHV08125, OLMK07634, DLGV08586, TPKE24441, DEID25924",TACO-PRATA
"GKNQ96825, EXUB98169, RMGO96293, KGWX96991, CHGY25331, JSNK24965",TACO-PRETO
"QJYP96479, IVTQ95872, NAIA96065, OJUL08426, PUVI24833, SCOC25185",TACO-VERMELHO
"BCQP76731, OPDQ77202, HELU41883, YCBR43186, NDBU95095",TESTADOR-BATERIA
"HROT54531, QCUO45669, LMVV45939, LKIV46198, RTTV49322",TESTADOR-VELA